{
  "$schema": "https://json-schema.org/draft/2020-12/schema",
  "type": "object",
  "properties": {
    "schemaVersion": {
      "type": "number",
      "const": 2
    },
    "release": {
      "type": "string",
      "pattern": "^\\d{4}-\\d{2}-\\d{2}\\.\\d+$"
    },
    "level": {
      "type": "string",
      "enum": [
        "constituency",
        "local-authority"
      ]
    },
    "area": {
      "type": "object",
      "properties": {
        "code": {
          "type": "string",
          "pattern": "^[ESW]\\d{8}$"
        },
        "name": {
          "type": "string",
          "minLength": 1
        },
        "slug": {
          "type": "string",
          "pattern": "^[a-z0-9]+(?:-[a-z0-9]+)*$"
        },
        "nation": {
          "type": "string",
          "enum": [
            "england",
            "wales",
            "scotland"
          ]
        },
        "region": {
          "type": "object",
          "properties": {
            "code": {
              "type": "string",
              "pattern": "^[ESW]\\d{8}$"
            },
            "name": {
              "type": "string",
              "minLength": 1
            }
          },
          "required": [
            "code",
            "name"
          ],
          "additionalProperties": false
        }
      },
      "required": [
        "code",
        "name",
        "slug",
        "nation",
        "region"
      ],
      "additionalProperties": false
    },
    "overlaps": {
      "type": "array",
      "items": {
        "type": "object",
        "properties": {
          "level": {
            "type": "string",
            "enum": [
              "constituency",
              "local-authority"
            ]
          },
          "code": {
            "type": "string",
            "pattern": "^[ESW]\\d{8}$"
          },
          "name": {
            "type": "string",
            "minLength": 1
          },
          "slug": {
            "type": "string",
            "pattern": "^[a-z0-9]+(?:-[a-z0-9]+)*$"
          },
          "populationShare": {
            "type": "number",
            "minimum": 0,
            "maximum": 1
          }
        },
        "required": [
          "level",
          "code",
          "name",
          "slug",
          "populationShare"
        ],
        "additionalProperties": false
      }
    },
    "population": {
      "type": "object",
      "properties": {
        "period": {
          "type": "string",
          "pattern": "^mid-\\d{4}$"
        },
        "total": {
          "type": "integer",
          "minimum": 0,
          "maximum": 9007199254740991
        },
        "aged0to15": {
          "type": "integer",
          "minimum": 0,
          "maximum": 9007199254740991
        },
        "aged16to64": {
          "type": "integer",
          "minimum": 0,
          "maximum": 9007199254740991
        },
        "aged66plus": {
          "type": "integer",
          "minimum": 0,
          "maximum": 9007199254740991
        }
      },
      "required": [
        "period",
        "total",
        "aged0to15",
        "aged16to64",
        "aged66plus"
      ],
      "additionalProperties": false
    },
    "facts": {
      "type": "array",
      "items": {
        "type": "object",
        "properties": {
          "metric": {
            "type": "string",
            "pattern": "^[a-z][a-z0-9]*(?:-[a-z0-9]+)*$"
          },
          "period": {
            "type": "string"
          },
          "denominators": {
            "minItems": 1,
            "type": "array",
            "items": {
              "type": "string",
              "enum": [
                "total",
                "per-resident",
                "per-aged-0-15",
                "per-aged-16-64",
                "per-aged-66-plus"
              ]
            }
          },
          "values": {
            "type": "array",
            "items": {
              "type": [
                "number",
                "null"
              ]
            }
          },
          "flags": {
            "type": "array",
            "items": {
              "type": "integer",
              "minimum": 0,
              "maximum": 255
            }
          },
          "ranks": {
            "type": "array",
            "items": {
              "anyOf": [
                {
                  "type": "integer",
                  "minimum": 1,
                  "maximum": 9007199254740991
                },
                {
                  "type": "null"
                }
              ]
            }
          }
        },
        "required": [
          "metric",
          "period",
          "denominators",
          "values",
          "flags",
          "ranks"
        ],
        "additionalProperties": false
      }
    },
    "spendByFamily": {
      "type": "object",
      "properties": {
        "period": {
          "type": "string",
          "pattern": "^\\d{4}-\\d{2}$"
        },
        "items": {
          "type": "array",
          "items": {
            "type": "object",
            "properties": {
              "family": {
                "type": "string",
                "enum": [
                  "state-pension",
                  "pension-credit",
                  "attendance-allowance",
                  "winter-fuel",
                  "personal-independence",
                  "disability-living",
                  "carers",
                  "universal-credit",
                  "housing-benefit",
                  "employment-support",
                  "jobseekers",
                  "income-support",
                  "other"
                ]
              },
              "value": {
                "type": "number"
              },
              "flags": {
                "type": "integer",
                "minimum": 0,
                "maximum": 255
              }
            },
            "required": [
              "family",
              "value",
              "flags"
            ],
            "additionalProperties": false
          }
        }
      },
      "required": [
        "period",
        "items"
      ],
      "additionalProperties": false
    },
    "series": {
      "type": "array",
      "items": {
        "type": "object",
        "properties": {
          "metric": {
            "type": "string",
            "pattern": "^[a-z][a-z0-9]*(?:-[a-z0-9]+)*$"
          },
          "denominator": {
            "type": "string",
            "enum": [
              "total",
              "per-resident",
              "per-aged-0-15",
              "per-aged-16-64",
              "per-aged-66-plus"
            ]
          },
          "periodKind": {
            "type": "string",
            "enum": [
              "fiscal-year",
              "month"
            ]
          },
          "periods": {
            "minItems": 1,
            "type": "array",
            "items": {
              "type": "string"
            }
          },
          "values": {
            "type": "array",
            "items": {
              "type": [
                "number",
                "null"
              ]
            }
          },
          "flags": {
            "type": "array",
            "items": {
              "type": "integer",
              "minimum": 0,
              "maximum": 255
            }
          }
        },
        "required": [
          "metric",
          "denominator",
          "periodKind",
          "periods",
          "values",
          "flags"
        ],
        "additionalProperties": false
      }
    },
    "decomposition": {
      "type": "array",
      "items": {
        "type": "object",
        "properties": {
          "family": {
            "type": "string",
            "enum": [
              "state-pension",
              "pension-credit",
              "attendance-allowance",
              "winter-fuel",
              "personal-independence",
              "disability-living",
              "carers",
              "universal-credit",
              "housing-benefit",
              "employment-support",
              "jobseekers",
              "income-support",
              "other"
            ]
          },
          "population": {
            "type": "array",
            "prefixItems": [
              {
                "type": "integer",
                "exclusiveMinimum": 0,
                "maximum": 9007199254740991
              },
              {
                "type": "integer",
                "exclusiveMinimum": 0,
                "maximum": 9007199254740991
              }
            ],
            "items": false,
            "minItems": 2,
            "maxItems": 2
          },
          "claimants": {
            "type": "array",
            "prefixItems": [
              {
                "type": "integer",
                "exclusiveMinimum": 0,
                "maximum": 9007199254740991
              },
              {
                "type": "integer",
                "exclusiveMinimum": 0,
                "maximum": 9007199254740991
              }
            ],
            "items": false,
            "minItems": 2,
            "maxItems": 2
          },
          "meanWeeklyAward": {
            "type": "array",
            "prefixItems": [
              {
                "type": "number",
                "exclusiveMinimum": 0
              },
              {
                "type": "number",
                "exclusiveMinimum": 0
              }
            ],
            "items": false,
            "minItems": 2,
            "maxItems": 2
          },
          "flags": {
            "type": "integer",
            "minimum": 0,
            "maximum": 255
          }
        },
        "required": [
          "family",
          "population",
          "claimants",
          "meanWeeklyAward",
          "flags"
        ],
        "additionalProperties": false
      }
    },
    "expected": {
      "type": "array",
      "items": {
        "type": "object",
        "properties": {
          "metric": {
            "type": "string",
            "pattern": "^[a-z][a-z0-9]*(?:-[a-z0-9]+)*$"
          },
          "actual": {
            "type": [
              "number",
              "null"
            ]
          },
          "expected": {
            "type": [
              "number",
              "null"
            ]
          },
          "residual": {
            "type": [
              "number",
              "null"
            ]
          },
          "flags": {
            "type": "integer",
            "minimum": 0,
            "maximum": 255
          },
          "missingInputs": {
            "type": "array",
            "items": {
              "type": "string",
              "enum": [
                "share-aged-0-15",
                "share-aged-66-plus",
                "deprivation-decile",
                "median-pay",
                "population-density"
              ]
            }
          }
        },
        "required": [
          "metric",
          "actual",
          "expected",
          "residual",
          "flags",
          "missingInputs"
        ],
        "additionalProperties": false
      }
    },
    "neighbours": {
      "type": "object",
      "properties": {
        "missingInputs": {
          "type": "array",
          "items": {
            "type": "string",
            "enum": [
              "share-aged-0-15",
              "share-aged-66-plus",
              "deprivation-decile",
              "median-pay",
              "population-density"
            ]
          }
        },
        "areas": {
          "type": "array",
          "items": {
            "type": "object",
            "properties": {
              "code": {
                "type": "string",
                "pattern": "^[ESW]\\d{8}$"
              },
              "name": {
                "type": "string",
                "minLength": 1
              },
              "slug": {
                "type": "string",
                "pattern": "^[a-z0-9]+(?:-[a-z0-9]+)*$"
              },
              "distance": {
                "type": "number",
                "minimum": 0
              }
            },
            "required": [
              "code",
              "name",
              "slug",
              "distance"
            ],
            "additionalProperties": false
          }
        }
      },
      "required": [
        "missingInputs",
        "areas"
      ],
      "additionalProperties": false
    },
    "deprivation": {
      "anyOf": [
        {
          "type": "object",
          "properties": {
            "source": {
              "type": "string",
              "pattern": "^[a-z0-9]+(?:-[a-z0-9]+)*$"
            },
            "nation": {
              "type": "string",
              "enum": [
                "england",
                "wales",
                "scotland"
              ]
            },
            "decile": {
              "type": "integer",
              "minimum": 1,
              "maximum": 10
            }
          },
          "required": [
            "source",
            "nation",
            "decile"
          ],
          "additionalProperties": false
        },
        {
          "type": "null"
        }
      ]
    },
    "representation": {
      "anyOf": [
        {
          "type": "object",
          "properties": {
            "member": {
              "type": "string",
              "minLength": 1
            },
            "party": {
              "type": "string",
              "minLength": 1
            },
            "since": {
              "type": "string",
              "format": "date",
              "pattern": "^(?:(?:\\d\\d[2468][048]|\\d\\d[13579][26]|\\d\\d0[48]|[02468][048]00|[13579][26]00)-02-29|\\d{4}-(?:(?:0[13578]|1[02])-(?:0[1-9]|[12]\\d|3[01])|(?:0[469]|11)-(?:0[1-9]|[12]\\d|30)|(?:02)-(?:0[1-9]|1\\d|2[0-8])))$"
            }
          },
          "required": [
            "member",
            "party",
            "since"
          ],
          "additionalProperties": false
        },
        {
          "type": "null"
        }
      ]
    },
    "election": {
      "anyOf": [
        {
          "type": "object",
          "properties": {
            "date": {
              "type": "string",
              "format": "date",
              "pattern": "^(?:(?:\\d\\d[2468][048]|\\d\\d[13579][26]|\\d\\d0[48]|[02468][048]00|[13579][26]00)-02-29|\\d{4}-(?:(?:0[13578]|1[02])-(?:0[1-9]|[12]\\d|3[01])|(?:0[469]|11)-(?:0[1-9]|[12]\\d|30)|(?:02)-(?:0[1-9]|1\\d|2[0-8])))$"
            },
            "electorate": {
              "type": "integer",
              "exclusiveMinimum": 0,
              "maximum": 9007199254740991
            },
            "validVotes": {
              "type": "integer",
              "exclusiveMinimum": 0,
              "maximum": 9007199254740991
            },
            "turnout": {
              "type": "number",
              "minimum": 0,
              "maximum": 1
            },
            "majority": {
              "type": "integer",
              "minimum": 0,
              "maximum": 9007199254740991
            },
            "majorityShare": {
              "type": "number",
              "minimum": 0,
              "maximum": 1
            },
            "candidates": {
              "minItems": 2,
              "type": "array",
              "items": {
                "type": "object",
                "properties": {
                  "party": {
                    "type": "string",
                    "minLength": 1
                  },
                  "name": {
                    "type": "string",
                    "minLength": 1
                  },
                  "votes": {
                    "type": "integer",
                    "minimum": 0,
                    "maximum": 9007199254740991
                  },
                  "share": {
                    "type": "number",
                    "minimum": 0,
                    "maximum": 1
                  }
                },
                "required": [
                  "party",
                  "name",
                  "votes",
                  "share"
                ],
                "additionalProperties": false
              }
            }
          },
          "required": [
            "date",
            "electorate",
            "validVotes",
            "turnout",
            "majority",
            "majorityShare",
            "candidates"
          ],
          "additionalProperties": false
        },
        {
          "type": "null"
        }
      ]
    },
    "conditions": {
      "anyOf": [
        {
          "type": "object",
          "properties": {
            "claimants": {
              "type": "array",
              "items": {
                "anyOf": [
                  {
                    "type": "integer",
                    "minimum": 0,
                    "maximum": 9007199254740991
                  },
                  {
                    "type": "null"
                  }
                ]
              }
            },
            "flags": {
              "type": "array",
              "items": {
                "type": "integer",
                "minimum": 0,
                "maximum": 255
              }
            }
          },
          "required": [
            "claimants",
            "flags"
          ],
          "additionalProperties": false
        },
        {
          "type": "null"
        }
      ]
    },
    "caveats": {
      "type": "array",
      "items": {
        "type": "string",
        "pattern": "^[a-z0-9]+(?:-[a-z0-9]+)*$"
      }
    }
  },
  "required": [
    "schemaVersion",
    "release",
    "level",
    "area",
    "overlaps",
    "population",
    "facts",
    "spendByFamily",
    "series",
    "decomposition",
    "expected",
    "neighbours",
    "deprivation",
    "representation",
    "election",
    "conditions",
    "caveats"
  ],
  "additionalProperties": false
}
